{
  "$schema": "https://json-schema.org/draft/2020-12/schema",
  "type": "object",
  "additionalProperties": false,
  "required": [
    "task_id",
    "conclusion",
    "result",
    "claimed_assurance",
    "scope",
    "completeness",
    "evidence",
    "limitations"
  ],
  "properties": {
    "task_id": {
      "const": "jacobian/research-diagnostics-v1-jcb-postdoc-012"
    },
    "conclusion": {
      "const": "COUNTEREXAMPLE_EXISTS"
    },
    "result": {
      "type": "object",
      "additionalProperties": false,
      "required": [
        "expected_conclusion",
        "answer_visible_summary",
        "boundary_statement",
        "key_facts"
      ],
      "properties": {
        "expected_conclusion": {
          "enum": [
            "PROVED",
            "DISPROVED",
            "COUNTEREXAMPLE_EXISTS",
            "EXACT_IDENTITY",
            "NO_GLOBAL_CONCLUSION"
          ]
        },
        "answer_visible_summary": {
          "type": "string",
          "minLength": 1
        },
        "boundary_statement": {
          "type": "string",
          "minLength": 1
        },
        "key_facts": {
          "type": "object"
        }
      }
    },
    "claimed_assurance": {
      "enum": [
        "UNVERIFIED",
        "COMPUTED",
        "CHECKED"
      ]
    },
    "scope": {
      "const": "jacobian/research-diagnostics-v1-jcb-postdoc-012 answer-visible diagnostic"
    },
    "completeness": {
      "const": "COMPLETE"
    },
    "evidence": {
      "type": "array",
      "minItems": 1,
      "items": {
        "type": "object",
        "additionalProperties": false,
        "required": [
          "path",
          "sha256"
        ],
        "properties": {
          "path": {
            "const": "evidence/answer.txt"
          },
          "sha256": {
            "type": "string",
            "pattern": "^sha256:[0-9a-f]{64}$"
          }
        }
      }
    },
    "limitations": {
      "type": "array",
      "items": {
        "type": "string"
      }
    }
  }
}