{"task_id":"jacobian/research-diagnostics-v1-jcb-postdoc-012","conclusion":"COUNTEREXAMPLE_EXISTS","result":{"expected_conclusion":"COUNTEREXAMPLE_EXISTS","answer_visible_summary":"The public project constructs a weakly quasi-complete Noetherian local ring that is not quasi-complete and supplies a large Lean formalization. The construction and proof are evaluator-visible but intentionally omitted from this prompt.","boundary_statement":"The mathematical portfolio lacks typed local-ring completions, descending ideal sequences, adic topology, and a domain checker. General Lean access is not a substitute for those semantic capabilities.","key_facts":{"construction":"weakly-quasi-complete not quasi-complete Noetherian local ring"}},"claimed_assurance":"COMPUTED","scope":"jacobian/research-diagnostics-v1-jcb-postdoc-012 answer-visible diagnostic","completeness":"COMPLETE","evidence":[{"path":"evidence/answer.txt","sha256":"sha256:e1e2849e8d27355fbbb9e7c6f345eab77551515f9cb93a56626f30bab3c9acac"}],"limitations":[]}